{
  "count": 2,
  "next": null,
  "previous": null,
  "results": [
    {
      "id": 74321,
      "team_id": 999999,
      "name": "New onboarding flow",
      "key": "new-onboarding-flow",
      "filters": {
        "groups": [
          {
            "properties": [],
            "rollout_percentage": 25,
            "variant": null
          }
        ],
        "payloads": {},
        "multivariate": null
      },
      "deleted": false,
      "active": true,
      "created_by": {
        "id": 42,
        "uuid": "0193a5b4-1234-7abc-8def-0123456789ab",
        "distinct_id": "redacted@example.com",
        "first_name": "BossHogg",
        "last_name": "Dogfood",
        "email": "redacted@example.com",
        "is_email_verified": true
      },
      "created_at": "2026-03-15T10:12:45.123456Z",
      "is_simple_flag": true,
      "rollout_percentage": 25,
      "ensure_experience_continuity": false,
      "experiment_set": [],
      "features": [],
      "rollback_conditions": [],
      "surveys": [],
      "performed_rollback": false,
      "can_edit": true,
      "tags": ["onboarding"],
      "usage_dashboard": null,
      "analytics_dashboards": [],
      "has_enriched_analytics": false,
      "user_access_level": "editor",
      "status": "ACTIVE",
      "evaluation_runtime": "all",
      "version": 3,
      "last_modified_by": null,
      "_create_in_folder": null,
      "is_remote_configuration": false,
      "has_encrypted_payloads": false
    },
    {
      "id": 74322,
      "team_id": 999999,
      "name": "Experimental checkout",
      "key": "experimental-checkout",
      "filters": {
        "groups": [
          {
            "properties": [],
            "rollout_percentage": 100,
            "variant": "control"
          },
          {
            "properties": [],
            "rollout_percentage": 100,
            "variant": "test"
          }
        ],
        "multivariate": {
          "variants": [
            { "key": "control", "name": "Control", "rollout_percentage": 50 },
            { "key": "test", "name": "Test", "rollout_percentage": 50 }
          ]
        },
        "payloads": {}
      },
      "deleted": false,
      "active": false,
      "created_by": null,
      "created_at": "2026-02-01T08:00:00Z",
      "is_simple_flag": false,
      "rollout_percentage": null,
      "ensure_experience_continuity": true,
      "experiment_set": [1201],
      "features": [],
      "rollback_conditions": [],
      "surveys": [],
      "performed_rollback": false,
      "can_edit": true,
      "tags": [],
      "usage_dashboard": 9876,
      "analytics_dashboards": [9876],
      "has_enriched_analytics": true,
      "user_access_level": "editor",
      "status": "ACTIVE",
      "evaluation_runtime": "all",
      "version": 1,
      "last_modified_by": null,
      "_create_in_folder": null,
      "is_remote_configuration": false,
      "has_encrypted_payloads": false
    }
  ]
}
